votes,fetch_url,title,longtext,answers,link,date,id,tags,
0,http://stackoverflow.com/search?sort=newest&page=4&pagesize=50&q=[openstack]Neutron,Q: openstack: how create bridge on guest vm,/db9c2d32a473c6643551 i have changed openstack config to # /etc/neutron/plugins/ml2/ml2_conf.ini [securitygroup] enable_security_group = False firewall_driver = neutron.agent.firewall.NoopFirewallDriver and # /etc  We would like to use nested kvm on guest machine in openstack. To expose nested guest machine to network we are going to use bridge. but our bridged interfaces does not get IP addresses by dhcp ,1,http://stackoverflow.com/questions/37496005/openstack-how-create-bridge-on-guest-vm,1/12/2017 19:45,ef11e5894cdaa120e4a72f16d1e4c1b1,"[u'openstack', u'openstack-nova', u'openstack-neutron']",Neutron
1,http://stackoverflow.com/search?sort=newest&page=4&pagesize=50&q=[openstack]Neutron,A: Openstack Neutron command workflow,"directly. All OpenStack command-line tools are implemented using the Python SDK. The neutron commands are in the project python-neutronclient . In the shell.py file you can find the command 'agent-list': agent.ListAgent as well as all other commands.  The OpenStack Python SDK implements Python bindings to the OpenStack API, which enables you to perform automation tasks in Python by making calls on Python objects rather than making REST calls ",1,http://stackoverflow.com/questions/21330985/openstack-neutron-command-workflow/21336180#21336180,1/12/2017 19:45,e1de5b5ad2713256bcc5a4b1d1f737c0,[],Neutron
0,http://stackoverflow.com/search?sort=newest&page=4&pagesize=50&q=[openstack]Neutron,A: what does end point mean in terms of Ceilometer API python?,"An ""endpoint"" simply means ""the URL at which you contact a service"". In OpenStack, the keystone service maintains a ""catalog"" of API endpoints. When you create a Ceilometer client object, it asks  catalog by running openstack endpoint list (if you have the openstack unified client available): $ openstack endpoint list +------...+-----------+--------------+---------------+ | ID ...| Region ",1,http://stackoverflow.com/questions/29147164/what-does-end-point-mean-in-terms-of-ceilometer-api-python/29153396#29153396,1/12/2017 19:45,ecaae07a5714420b928cef875c188f7e,[],Neutron
0,http://stackoverflow.com/search?sort=newest&page=4&pagesize=50&q=[openstack]Neutron,A: Puppet Resource Ordering not working,] -> Exec['neutron-db-sync'] Haproxy::Service['haproxy'] -> Exec['heat-dbsync'] Haproxy::Service['haproxy'] -> Exec['ceilometer-dbsync'] Haproxy::Service['haproxy'] -> Exec['cinder-manage db_sync ,1,http://stackoverflow.com/questions/40316293/puppet-resource-ordering-not-working/40323262#40323262,1/12/2017 19:45,56c2368174582432769081c8aba5d279,[],Neutron
0,http://stackoverflow.com/search?sort=newest&page=4&pagesize=50&q=[openstack]Neutron,A: OpenStack: Assigning IPs manually,Use Neutron network and specifically go for ovs plugin. Because the instructions I am giving below will only work for it. You have to setup the ovs plugin with the following configuration in '/etc  /neutron/plugins/openvswitch/ovs_neutron_plugin.ini' [OVS] tenant_network_type = gre network_vlan_ranges = EXTNet enable_tunneling = True tunnel_type = gre tunnel_id_ranges = 1:1000 integration_bridge ,1,http://stackoverflow.com/questions/21305051/openstack-assigning-ips-manually/21330446#21330446,1/12/2017 19:45,39641178769d3d0c280bc09f2325d80b,[],Neutron
0,http://stackoverflow.com/search?sort=newest&page=4&pagesize=50&q=[openstack]Neutron,A: Why there are multiple processes for neutron-server in Juno,It's typical for python to have master and workers. For neutron it's controlled by 'api_workers' variable in neutron.conf. Guessing by number you have 24 core computer (12 cores and HT?). You got 25 ,1,http://stackoverflow.com/questions/29960356/why-there-are-multiple-processes-for-neutron-server-in-juno/30054244#30054244,1/12/2017 19:45,831f2939a8fa44ccc756791640089661,[],Neutron
1,http://stackoverflow.com/search?sort=newest&page=4&pagesize=50&q=[openstack]Neutron,A: any custom openstack centos image with a set password i can use?,"If Neutron isn't set up correctly, you're not going to be able to do much with your OpenStack environment. However, even with broken networking, you can pass your user-data script to the instance ",1,http://stackoverflow.com/questions/28484863/any-custom-openstack-centos-image-with-a-set-password-i-can-use/28485765#28485765,1/12/2017 19:45,8ec5c4bc8fd0d235939d663eb73b736b,[],Neutron
0,http://stackoverflow.com/search?sort=newest&page=4&pagesize=50&q=[openstack]Neutron,A: Invalid OpenStack Identity credentials - Glance,"First, you need to source the file keystone_admin file located in /root source keystone_admin Then you can run any command like glance, nova, neutron, etc... If you already did that, then change ",1,http://stackoverflow.com/questions/24369303/invalid-openstack-identity-credentials-glance/24376392#24376392,1/12/2017 19:45,cc94e4ada02419e3e2ba5dd85d03721e,[],Neutron
1,http://stackoverflow.com/search?sort=newest&page=4&pagesize=50&q=[openstack]Neutron,Q: OpenStack: Assigning IPs manually,"I am deploying OpenStack Havana over Ubuntu Server 12.04 LTS following the official documentation (http://docs.openstack.org/havana/install-guide/install/apt/content/index.html). I'm using a single  not using Neutron, just Nova Network. Also, I should say I'm far from being a networking expert. The problem is the next one: in my enterprise, as far as I know, every device has a public IP ",1,http://stackoverflow.com/questions/21305051/openstack-assigning-ips-manually,1/12/2017 19:45,5a281c9f956ede3d29c42e00f7e936c0,"[u'networking', u'ubuntu', u'ip', u'openstack']",Neutron
-1,http://stackoverflow.com/search?sort=newest&page=4&pagesize=50&q=[openstack]Neutron,Q: iptables command to bridge openstack virtual network,I successfully installed openstack on spare server using the ubuntu single-node installer script. The openstack status page on the underlying ubuntu instance is green across the board. From the host  ubuntu instance I can ping / ssh to all of the various openstack instances which have been started on the virtual network. I now want to access the horizon dashboard from my pc on the local network ,1,http://stackoverflow.com/questions/36345231/iptables-command-to-bridge-openstack-virtual-network,1/12/2017 19:45,98e830f1a2ff80081bee693353f2cd3a,"[u'openstack', u'iptables', u'nat']",Neutron
1,http://stackoverflow.com/search?sort=newest&page=4&pagesize=50&q=[openstack]Neutron,"A: Openstack, neutron, Can't ping external network",. This means that when you send you ICMP packets to the external gateway they would go the default gateway set on the network node and not be answered. This network lives in the neutron router's network  namespace. Third you have the tenant network which also does not live in your main network space but in the same neutron router namespace. To exemplify I will show you how it looks in my setup. I have ,1,http://stackoverflow.com/questions/25543925/openstack-neutron-cant-ping-external-network/29277091#29277091,1/12/2017 19:45,feb9635ef5a6a5faaad4cf64958b43d2,[],Neutron
-1,http://stackoverflow.com/search?sort=newest&page=4&pagesize=50&q=[openstack]Neutron,Q: Openstack - hardware requirements,"to do it myself, than colo or something else. Plus, I really like lots of blinking lights :D A year or so, I heard about Openstack and have been looking cursory at it since then. Seems big  . So, I've been looking at https://en.wikipedia.org/wiki/OpenStack#Components and from that came to the following conclusion: Required: (Nova, Glance, Horizon, Cinder) This seems to be the ""core ",1,http://stackoverflow.com/questions/36618037/openstack-hardware-requirements,1/12/2017 19:45,6940987cfaa99de83dfbd876b2e16536,"[u'hardware', u'openstack', u'requirements']",Neutron
0,http://stackoverflow.com/search?sort=newest&page=4&pagesize=50&q=[openstack]Neutron,Q: Python module importation error,"Trying to install Openstack Kilo, nova logs returns TRACE nova from neutronclient.neutron import v2_0 as neutronv20 TRACE nova ImportError: No module named neutron I tried to import some modules  of neutronclient with Python : >>> from neutronclient.neutron import v2_0 Traceback (most recent call last): File ""<stdin>"", line 1, in <module> ImportError: No module named neutron >>> from ",1,http://stackoverflow.com/questions/31049369/python-module-importation-error,1/12/2017 19:45,f60639967af447f1089ecb3dee4e1ce6,"[u'python', u'package', u'openstack', u'openstack-neutron']",Neutron
0,http://stackoverflow.com/search?sort=newest&page=4&pagesize=50&q=[openstack]Neutron,A: How to integrate Opendaylight with OpenStack? How does Opendaylight operate when integrated …,"Neutron provides ""networking as a service"" between interface devices managed by other Openstack services, but it's just an API which parse messages to REAL messages in the core of the network  and Opendaylight really deals with the core of the network itself. While OpenDaylight Controller provides several ways to integrate with OpenStack, you might use VTN features available on OpenDaylight ",1,http://stackoverflow.com/questions/31449401/how-to-integrate-opendaylight-with-openstack-how-does-opendaylight-operate-when/32058822#32058822,1/12/2017 19:45,d36a444b356058b7a1d779c600bc1483,[],Neutron
0,http://stackoverflow.com/search?sort=newest&page=4&pagesize=50&q=[openstack]Neutron,Q: OpenStack OpenContrail Horizon Login Error,"Hello i am a newbie working with OpenStack, i have installed openstack + opencontrail by following (Single Node setup): http://www.opencontrail.org/opencontrail-quick-start-guide/ Opencontrail  ()} [Thu Jul 28 23:15:02 2016] [error] File ""/usr/share/openstack-dashboard/openstack_dashboard/wsgi/../../openstack_dashboard/dashboards/admin/overview/views.py"", line 60, in get_data [Thu Jul 28 23 ",1,http://stackoverflow.com/questions/38648369/openstack-opencontrail-horizon-login-error,1/12/2017 19:45,eeedc4d54a586462a9ffae146e698663,"[u'openstack', u'openstack-neutron', u'horizon']",Neutron
0,http://stackoverflow.com/search?sort=newest&page=4&pagesize=50&q=[openstack]Neutron,Q: Facing errors in uninstalling openstack devstack,": command not found WARNING: setting legacy OS_TENANT_NAME to support cli tools. /devstack/lib/nova: line 114: ip: command not found WARNING: Using lib/neutron-legacy is deprecated  , and it will be removed in the future /devstack/lib/neutron_plugins/services/l3: line 91: ip: command not found [Call Trace] ./unstack.sh:71:source devstack/lib/neutron-legacy:258:source ",1,http://stackoverflow.com/questions/39405541/facing-errors-in-uninstalling-openstack-devstack,1/12/2017 19:45,3855e3b38c235d63bfcc247c4aae353b,"[u'openstack', u'devstack', u'rhel7']",Neutron
3,http://stackoverflow.com/search?sort=newest&page=3&pagesize=50&q=[openstack]Neutron,A: Openstack Heat & Ansible. VM spinup and App deployment,-atomic-20150615 flavor: m1.small key_name: lars networks: - port: {get_resource: node_eth0} node_eth0: type: OS::Neutron::Port properties: network: net0  security_groups: - default fixed_ips: - subnet: 82d04267-635f-4eec-8211-10e40fcecef0 node_floatin,1,http://stackoverflow.com/questions/30894684/openstack-heat-ansible-vm-spinup-and-app-deployment/30895858#30895858,1/12/2017 19:45,c5c72b8f7cd5307a664bdd9a739a8510,[],Neutron
0,http://stackoverflow.com/search?sort=newest&page=3&pagesize=50&q=[openstack]Neutron,Q: OpenStack: Could not delete Security Group because it says it is in use,"When I'm trying to delete a security group, the delete operation fails neutron security-group-delete f54609e7-f3a3-4b44-8060-2675058ea786 Security Group f54609e7-f3a3-4b44-8060-2675058ea786 in use ",1,http://stackoverflow.com/questions/39487615/openstack-could-not-delete-security-group-because-it-says-it-is-in-use,1/12/2017 19:45,1c43d392bee66a84a2764d366005f634,"[u'openstack', u'openstack-neutron']",Neutron
1,http://stackoverflow.com/search?sort=newest&page=3&pagesize=50&q=[openstack]Neutron,A: DevStack: failed to create new CentOS instance,"available HD space, the flavor specs, and the image specs. Network: Let's discard neutron. Instead of assigning the network, assign a port. Create a port in neutron, and in the nova boot command, assign ",1,http://stackoverflow.com/questions/40023981/devstack-failed-to-create-new-centos-instance/40027079#40027079,1/12/2017 19:45,990efbbf5c9bc9e9e5ea064ee75f9c77,[],Neutron
0,http://stackoverflow.com/search?sort=newest&page=3&pagesize=50&q=[openstack]Neutron,Q: Kubernetes with an external openstack load balancer not working,(IP - 192.168.55.60) stack@vagrant-ubuntu-trusty-64:~/devstack$ neutron --version 6.0.0 I am trying to use openstack's loadbalancer to load balance a service running in the k8s cluster. I have made  =openstack Following are the contents of /etc/sysconfig/kube_openstack_config [Global] auth-url=http://192.168.55.60/identity_admin username=admin password=password tenant-name=admin region ,1,http://stackoverflow.com/questions/40674539/kubernetes-with-an-external-openstack-load-balancer-not-working,1/12/2017 19:45,968d75a8eb40b88f79afea3e7f17bce7,"[u'kubernetes', u'openstack']",Neutron
0,http://stackoverflow.com/search?sort=newest&page=3&pagesize=50&q=[openstack]Neutron,"A: Openstack, make my insstance acessible from different machine","succeeds, then you should be able to access VM over network. In case if step 2 fails, check below things. Run neutron floatingip-list and check if you have FIP configured for Instance Go to to nova-api and check logs for clue ",1,http://stackoverflow.com/questions/30684371/openstack-make-my-insstance-acessible-from-different-machine/30838758#30838758,1/12/2017 19:45,1a4da85fe9a6223364dc1e16a9ef54b5,[],Neutron
-1,http://stackoverflow.com/search?sort=newest&page=3&pagesize=50&q=[openstack]Neutron,Q: Can we send requests directly on a bare metal machine in OpenStack?,Do I need Controllers and Neutron nodes to send requests on a bare metal machine in OpenStack? Can we send requests directly on a bare metal machine without passing them through controller/neutron nodes? ,1,http://stackoverflow.com/questions/36518457/can-we-send-requests-directly-on-a-bare-metal-machine-in-openstack,1/12/2017 19:45,594206f2495e1bbe40a4508b1120fe1e,"[u'networking', u'openstack', u'network-interface', u'openstack-neutron']",Neutron
0,http://stackoverflow.com/search?sort=newest&page=3&pagesize=50&q=[openstack]Neutron,Q: Create kubernetes load balance on openstack failed by “No address found for host”,"I installed a juno release openstack on several physical hosts. neutron, nova, glance, swift, horizon are installed. nova-lbaas is installed too, and the back end is HAProxy. The nova-lbaas works  well. Then I configured a Kubernetes cluster on the VMs created by openstack, and the nodePort manner works well, but when I tried to use the loadBalancer manner, it fails by ""No address found for host ",1,http://stackoverflow.com/questions/36258190/create-kubernetes-load-balance-on-openstack-failed-by-no-address-found-for-host,1/12/2017 19:45,234061c0ba9c7416d1bbaf74701e7941,"[u'openstack', u'kubernetes']",Neutron
0,http://stackoverflow.com/search?sort=newest&page=3&pagesize=50&q=[openstack]Neutron,Q: retrieve id of the network with openstack API and shell script,"I need to retrieve the id of the network created with shell script and openstack API. Is there a way to do so? neutron net-create test-net --provider:network_type vlan --provider:physical_network  physnet2 --provider:segmentation_id 22 neutron subnet-create test-net --name test-subnet --allocation-pool start=10.153.9.20,end=10.153.9.34 --gateway 10.153.8.1 10.153.8.0/22 ",1,http://stackoverflow.com/questions/29793187/retrieve-id-of-the-network-with-openstack-api-and-shell-script,1/12/2017 19:45,a0021da3ac303a525109d5770db92884,"[u'openstack', u'openstack-nova']",Neutron
0,http://stackoverflow.com/search?sort=newest&page=3&pagesize=50&q=[openstack]Neutron,A: Openstack and devstack,"/install/quickstart/ In this, you can choose which services you would like to install. For example you may choose to install Neutron for networking purposes, instead of using nova. Also, it lets you deploy multiple instances of compute nodes by just providing it's IP !! ",1,http://stackoverflow.com/questions/21729860/openstack-and-devstack/38087015#38087015,1/12/2017 19:45,ac0dac2fb9a8eb5427eb0fc909335523,[],Neutron
0,http://stackoverflow.com/search?sort=newest&page=3&pagesize=50&q=[openstack]Neutron,A: how to get instances back after reboot in openstack,"I've found some old discussion http://www.gossamer-threads.com/lists/openstack/dev/8772 AFAIK at the present time OpenStack (Icehouse) still not completely aware about environments inside it, so  this correctly (e.g. neutron will correctly configure all L3 rules according to DB records, etc.) Honestly I'm pretty sure they won't... The answer depends of what you need to achieve: If you need ",1,http://stackoverflow.com/questions/23150148/how-to-get-instances-back-after-reboot-in-openstack/24516327#24516327,1/12/2017 19:45,cc7e9ff834e14ea2c93cebeff3b3aa42,[],Neutron
0,http://stackoverflow.com/search?sort=newest&page=3&pagesize=50&q=[openstack]Neutron,A: designate network id when creating the network,The answer is as simple as NO! This option is not available from the command line client. For the supported parameters you can refer to: netron net-create neutron subnet-create As I see ,1,http://stackoverflow.com/questions/29770844/designate-network-id-when-creating-the-network/29775814#29775814,1/12/2017 19:45,ad19da25d6d8bf615d616b089ac94aea,[],Neutron
0,http://stackoverflow.com/search?sort=newest&page=3&pagesize=50&q=[openstack]Neutron,Q: DevStack: failed to create new CentOS instance,/compute/api.py:2215 n-api.log:2016-10-13 22:09:28.184 DEBUG neutronclient.v2_0.client [req-d9327bbd-d333-4d37-8651-57e95d21396b admin admin] GET call to neutron for http://10.61.148.89:9696  ] GET call to neutron for http://10.61.148.89:9696/v2.0/ports.json?device_id=b9f97618-085b-4d2b-bc94-34f3b953e2ee&device_id=d6c67c2f-0d21-4ef8-bcfe-eba852ed0cc1 used request id req-645a777a-35df ,1,http://stackoverflow.com/questions/40023981/devstack-failed-to-create-new-centos-instance,1/12/2017 19:45,e87a154caabf79131ff0e33ec048c4ec,"[u'openstack', u'devstack']",Neutron
0,http://stackoverflow.com/search?sort=newest&page=3&pagesize=50&q=[openstack]Neutron,A: WARNING neutron_lbaas.services.loadbalancer.drivers.haproxy.namespace_driver [-] Stats socke…,I had the same problem. For me the messages stopped as soon as I assigned a VIP to the LBaaS. The stats socket is in a directory with the ID as part of it: /var/lib/neutron/lbaas/<lbaas-id> But this directory is created the moment you assign a VIP. ,1,http://stackoverflow.com/questions/35102066/warning-neutron-lbaas-services-loadbalancer-drivers-haproxy-namespace-driver/36544429#36544429,1/12/2017 19:45,0c296b01a78220ba1b5a86496e44a390,[],Neutron
2,http://stackoverflow.com/search?sort=newest&page=3&pagesize=50&q=[openstack]Neutron,Q: liberty openstack ubuntu install guide fails to ping router,I followed the install guide for liberty launching instances on private networks (option 2) but I am unable to ping the virtual router neutron router-port-list router ,1,http://stackoverflow.com/questions/35088971/liberty-openstack-ubuntu-install-guide-fails-to-ping-router,1/12/2017 19:45,1f54e279b03b249bb092d48ca8734df0,"[u'openstack', u'openstack-neutron']",Neutron
0,http://stackoverflow.com/search?sort=newest&page=3&pagesize=50&q=[openstack]Neutron,A: Can't ping or ssh my VM in openstack,"Please restart Neutron services on controller, networking and Compute nodes. ",1,http://stackoverflow.com/questions/40290288/cant-ping-or-ssh-my-vm-in-openstack/40309709#40309709,1/12/2017 19:45,6416d60866a522898b98df02eecb46d1,[],Neutron
1,http://stackoverflow.com/search?sort=newest&page=3&pagesize=50&q=[openstack]Neutron,Q: Start and Stop script of ubuntu 12.04,I have a script (twoRules.sh) which add rules to ovs plugin bridge. The rules gets deleted when someone does service neutron-plugin-openvswitch-agent restart or reboots the system. So where should I  put my scripts so that after the restart of neutron-plugin-openvswitch-agent the (twoRules.sh) scripts get executed successfully and rules remain added. I tried putting it in /etc/init.d/neutron ,1,http://stackoverflow.com/questions/23740886/start-and-stop-script-of-ubuntu-12-04,1/12/2017 19:45,695e948e1e20624dffca919652dad273,"[u'linux', u'bash', u'shell', u'ubuntu', u'openstack']",Neutron
0,http://stackoverflow.com/search?sort=newest&page=3&pagesize=50&q=[openstack]Neutron,A: Jclouds - Specify a network interface when assigning floating IP,"(); ports.get(0).getId(); // Returns the uuid of the first port. You can get neutron with this maven dependency: <dependency> <groupId>org.apache.jclouds.labs</groupId> <artifactId>openstack-neutron</artifactId> <version>1.8.0</version> </dependency>  You can use jclouds Neutron to list existing ports and then get their uuids (it should be the port id). PortApi api = neutronApi.getPortApi(""region""); List<Port> ports = api.list().concat().toList ",1,http://stackoverflow.com/questions/25257923/jclouds-specify-a-network-interface-when-assigning-floating-ip/25272096#25272096,1/12/2017 19:45,abc1289cbcc619eaf46793b1f6bab42c,[],Neutron
0,http://stackoverflow.com/search?sort=newest&page=3&pagesize=50&q=[openstack]Neutron,Q: Cannot create docker container in OpenStack,"I have problem about setup nova-docker (docker hypervisor) on multi-node OpenStack (version Juno), my OS is Ubuntu 14.04 I followed: https://wiki.openstack.org/wiki/Docker, when I create a container  = novadocker.virt.docker.DockerDriver network_api_class = nova.network.neutronv2.api.API security_group_api = neutron linuxnet_interface_driver = nova.network.linux_net.LinuxOVSInterfaceDriver ",1,http://stackoverflow.com/questions/30975069/cannot-create-docker-container-in-openstack,1/12/2017 19:45,62a3f0052761faad11ea2d495b28f5e3,"[u'docker', u'openstack']",Neutron
0,http://stackoverflow.com/search?sort=newest&page=3&pagesize=50&q=[openstack]Neutron,A: How to pass josn/list values to a template in HEAT user_data,: - custom_constraint: glance.image my_network: type: string description: Neutron Network default: public-internet-access constraints: - custom_constraint: neutron.network ,1,http://stackoverflow.com/questions/39708962/how-to-pass-josn-list-values-to-a-template-in-heat-user-data/39818908#39818908,1/12/2017 19:45,c51b6f450c7501bd021ab59e94884b5e,[],Neutron
0,http://stackoverflow.com/search?sort=newest&page=3&pagesize=50&q=[openstack]Neutron,A: Devstack failed with openstackclient.shell Exception raised:python-neutronclient,", and so on). That's why those directories are taken as part of python path. There are also some egg-link files which point to openstack client project folders under /opt/stack, e.g. ~$ cat /usr/local  will be fixed. Please be noted that you maybe keep the openstack client packages installed under /user/local/lib/python2.7/dist-packages updated to latest version. You can do this by manually executing 'pip ",1,http://stackoverflow.com/questions/28049159/devstack-failed-with-openstackclient-shell-exception-raisedpython-neutronclient/28063020#28063020,1/12/2017 19:45,a541ab4c188114f6e818c8ca5a4eb94b,[],Neutron
-1,http://stackoverflow.com/search?sort=newest&page=3&pagesize=50&q=[openstack]Neutron,Q: How to restart ceilometer service,"I changed pulling intervals in /etc/ceilometer/pipeline.yaml file from 600 to 60 and can't make the service to use new values. I restarted everything that relates to ceilometer in openstack-status  command, but that did not work. Can somebody tell me the proper way how to do it? I am using Openstack Liberty on Ubuntu 14.04 LTS root@OS1:~# openstack service list ",1,http://stackoverflow.com/questions/39775986/how-to-restart-ceilometer-service,1/12/2017 19:45,b60c417fdfe7089c3c81c2b71bf21ba8,"[u'openstack', u'ceilometer']",Neutron
0,http://stackoverflow.com/search?sort=newest&page=3&pagesize=50&q=[openstack]Neutron,Q: openstack service failed when creating the password plugin,"I installed openstack through packstack. However I am having a tough time dealing with the commands. openstack service list --long I get: Discovering versions from the identity service failed  another command for the neutron, gave me the same response. Kindly help. Absolutely new in this arena. I do not know what logs to paste, as I am very new,but you can let me know. However I can start ",1,http://stackoverflow.com/questions/38046214/openstack-service-failed-when-creating-the-password-plugin,1/12/2017 19:45,afd61444421575664951d72bbec4093d,"[u'openstack', u'centos7']",Neutron
1,http://stackoverflow.com/search?sort=newest&page=3&pagesize=50&q=[openstack]Neutron,Q: RPC calls in OpenStack,"How RPC calls are implemented between modules of OpenStack specially Nova and Neutron? I want to call a neutron method in Nova through RPC. Searched throughout the web, but couldn't find any easy understandable explanation. Any link/document would be helpful. ",1,http://stackoverflow.com/questions/19557866/rpc-calls-in-openstack,1/12/2017 19:45,8d95b1fb8f6701ee0f9b859039567099,"[u'rpc', u'openstack', u'openstack-nova']",Neutron
