votes,fetch_url,title,longtext,answers,link,date,id,tags,
1,http://stackoverflow.com/search?sort=newest&page=8&pagesize=50&q=[openstack]Nova,A: Openstack create volume via Nova API,"In newer releases of OpenStack it is preferable to make use of the Cinder API rather than Nova API. In folsom, Cinder uses IDENTICAL API refs to Nova volume related API sets. This is because __,0""",http://stackoverflow.com/questions/15408605/openstack-create-volume-via-nova-api/15418504#15418504,10:57.4,2322524e638227e3b314f9c7458d143d,[],Nova,
0,http://stackoverflow.com/search?sort=newest&page=8&pagesize=50&q=[openstack]Nova,Q: Add Security Groups to Instance in Openstack,"I am trying to use Apache JClouds to add/remove a particular Security Group to some instances (which are already running) in a zone. I know that this can be done using the Nova-CLI. Could some one point out how this is done using jclouds? The documentation doesnt really say all that much. __,0""",http://stackoverflow.com/questions/23452621/add-security-groups-to-instance-in-openstack,10:57.6,327c1396ff0c53c8a517636be6dba37b,"[u'java', u'cloud', u'openstack', u'jclouds']",Nova,
-1,http://stackoverflow.com/search?sort=newest&page=8&pagesize=50&q=[openstack]Nova,Q: devstack | stack.sh ran successful but Hypervisor is not coming up,"/nova/nova/api/openstack/__init__.py:284 n-api.log:2017-01-06 08:59:52.631 DEBUG nova.api.openstack [req-a864db48-b9aa-4f02-86f9-c3e14e45aac0 None None] Extended resource: os-hypervisors from (pid=27828 __) _register_resources /opt/stack/nova/nova/api/openstack/__init__.py:287 n-api.log:2017-01-06 08:59:52.766 DEBUG nova.api.openstack [req-a864db48-b9aa-4f02-86f9-c3e14e45aac0 None None] Running __,0""",http://stackoverflow.com/questions/41559493/devstack-stack-sh-ran-successful-but-hypervisor-is-not-coming-up,10:57.8,dc9648d218375733acf0631c3123332b,"[u'openstack', u'devstack', u'hypervisor']",Nova,
1,http://stackoverflow.com/search?sort=newest&page=8&pagesize=50&q=[openstack]Nova,A: what is the process of close a instance on openstack?,"I assume by close you mean ""terminate"". When terminating an instance the running virtual machine with an instance id of X is shut down and removed from the physical host it exists on. The nova __client query for this would be: nova delete <instance-id> or something to that effect. When you make that query the python-novaclient is interfacing with its own internal API to reach out to the nova __,0""",http://stackoverflow.com/questions/15263292/what-is-the-process-of-close-a-instance-on-openstack/15278597#15278597,10:57.9,958e253a0b5c1278ca5585511b4ac638,[],Nova,
1,http://stackoverflow.com/search?sort=newest&page=8&pagesize=50&q=[openstack]Nova,Q: Openstack working from my instance: Connecting to nova.clouds.ubuntu Cannot initiate connection,"I am new to Openstack, I've installed it using devstack. I launched an instance using ubuntu server cloud image with heat flavor. I can ssh to the instance. The problem is when trying to do: sudo __apt-get update sudo apt-get install openjdk-7-jdk I have 0% (connecting to nova.clouds.archive.ubuntu.com ip@) It keeps changing the ip@ then error cannot initiate connection to nova connect __,0""",http://stackoverflow.com/questions/30125928/openstack-working-from-my-instance-connecting-to-nova-clouds-ubuntu-cannot-init,10:58.1,a34ed41f2232c17ef8975af05b7cead9,"[u'ubuntu', u'openstack', u'devstack', u'ubuntu-cloud']",Nova,
0,http://stackoverflow.com/search?sort=newest&page=8&pagesize=50&q=[openstack]Nova,Q: How to capture reply rabbitmq message Corresponding to a RPC.call Request message in OpenStack?,"am trying to intercept all RPC messages (both Request & Reply Message) passing through rabbitmq system in OpenStack. In OpenStack all request messages pass through a single exchange named ""nova __RPC call and cast are two different types of message passing protocol in OpenStack. In case of RPC.call, the invoker (or caller) waits for the reply or ack messsage from the worker (callee). I __,0""",http://stackoverflow.com/questions/20672509/how-to-capture-reply-rabbitmq-message-corresponding-to-a-rpc-call-request-messag,10:58.3,20c31fc14c912d5675202344587dd1de,"[u'rabbitmq', u'rpc', u'openstack']",Nova,
1,http://stackoverflow.com/search?sort=newest&page=8&pagesize=50&q=[openstack]Nova,Q: Installing novadocker for openstack,"2014-09-29 14:59:47.233 22982 TRACE nova.virt.driver virtapi) 2014-09-29 14:59:47.233 22982 TRACE nova.virt.driver File ""/usr/lib/python2.7/dist-packages/nova/openstack/common/importutils.py __/lib/python2.7/dist-packages/nova/openstack/common/importutils.py"", line 28, in import_class 2014-09-29 14:59:47.233 22982 TRACE nova.virt.driver __import__(mod_str) 2014-09-29 14:59:47.233 22982 __,0""",http://stackoverflow.com/questions/26067481/installing-novadocker-for-openstack,10:58.5,c0583b9083666c83ff8a724515b49bfe,"[u'configuration', u'docker', u'openstack', u'openstack-nova']",Nova,
6,http://stackoverflow.com/search?sort=newest&page=8&pagesize=50&q=[openstack]Nova,A: DevStack Installation Error: Directory 'opt/stack/nova' is not installable,"Try the following commands. Theses should get you working sudo rm -rf /opt/stack/nova sudo apt-get purge python-paste sudo apt-get install python-paste sudo apt-get purge python-pastedeploy sudo apt-get install python-pastedeploy do an unstack.sh and stack.sh again __,0""",http://stackoverflow.com/questions/25317919/devstack-installation-error-directory-opt-stack-nova-is-not-installable/25389469#25389469,10:58.8,8cf2ea726a4d77c8639545dad2a21962,[],Nova,
0,http://stackoverflow.com/search?sort=newest&page=8&pagesize=50&q=[openstack]Nova,A: Finding PID's of Virtual Machine in openstack,"grep ""79d87652-8c8e-4afa-8c13-32fbcbf98e76"" --include=libvirt.xml /path/to/nova/instances -r -A 2 | grep ""<name"" | cut -d "" "" -f 3 allows to find ""instance-"" which can be mapped to ps aux output of ""-name"" parameter. so you can map openstack instance id to pid. __,0""",http://stackoverflow.com/questions/18986976/finding-pids-of-virtual-machine-in-openstack/26675720#26675720,10:59.0,ddf8f58bb37388d04beb7a1bbe66fe2b,[],Nova,
0,http://stackoverflow.com/search?sort=newest&page=8&pagesize=50&q=[openstack]Nova,A: Getting nova:628:die trying to start OpenStack nova module,"Researching I found the reason about this problem, and it was because in the directory /etc/nova there were two files with the owner=nova, and aparently this user is created automatically by devstack. The solution was to change the owner of these files to my user. __,0""",http://stackoverflow.com/questions/19843239/getting-nova628die-trying-to-start-openstack-nova-module/19843835#19843835,10:59.1,c1f33cb639d38a17730a037b0afe2ca2,[],Nova,
0,http://stackoverflow.com/search?sort=newest&page=8&pagesize=50&q=[openstack]Nova,Q: Can't display _�flavors_� interface in OpenStack Horizon Dashboard,"After installing in a Ubuntu Server 13 Machine Several Openstack modules (Keystone, Glance, Nova, Neutron) I've installed Horizon. I can log with no problem as an admin, display every menu __Location: /usr/share/openstack-dashboard/openstack_dashboard/wsgi/../../openstack_dashboard/api/nova.py in flavor_list, line 406 Python Executable: /usr/bin/python Python Version: 2.7.5 __,0""",http://stackoverflow.com/questions/20090300/cant-display-flavors-interface-in-openstack-horizon-dashboard,10:59.2,5e11db63c89e9409010e7896aa06e4f0,"[u'django', u'openstack', u'openstack-horizon']",Nova,
1,http://stackoverflow.com/search?sort=newest&page=8&pagesize=50&q=[openstack]Nova,A: Ceilometer group by metadata,"If you attach metadata with the prefix of metering. to an instance (eg: metering.some_name) $ nova show <instance_id> ... | metadata | {""metering.some_name"": ""some_value""} | ... Then you can get __,0""",http://stackoverflow.com/questions/28959060/ceilometer-group-by-metadata/33771124#33771124,10:59.4,4010294fdd76027b9ef9ef5bd09af0bc,[],Nova,
0,http://stackoverflow.com/search?sort=newest&page=8&pagesize=50&q=[openstack]Nova,Q: How can I find out the total number of physical cores from an entire OpenStack based cloud?,"an OpenStack Cloud. I am trying out a few things and I started playing with the nova python client, since nova compute sits in one place and interacts through different api's with different __, merge that with what I get from nova and I would be done, but this doesn't actually suit me very well, so I need a better solution, one that can use the openstack projects if possible or one that can __,0""",http://stackoverflow.com/questions/37155367/how-can-i-find-out-the-total-number-of-physical-cores-from-an-entire-openstack-b,10:59.6,5265c89ca906887e172b0b4db0659389,"[u'cloud', u'cpu', u'openstack', u'core']",Nova,
2,http://stackoverflow.com/search?sort=newest&page=8&pagesize=50&q=[openstack]Nova,Q: OpenStack API CreateInstance,"After I create an instance on OpenStack with the REST API Using the Nova endpoint the operation succeeds with the server id reference. If I immediately try to get any of the details of the network __that can use on OpenStack to get a ""is ready"" state after a creation? If there is no operation to determine that the server is ready, then is there a recommended wait time in the documentation? __,0""",http://stackoverflow.com/questions/15801457/openstack-api-createinstance,10:59.7,1d710280c3046058b0ee58b4a664dcb8,"[u'rest', u'virtual-machine', u'provisioning', u'openstack']",Nova,
0,http://stackoverflow.com/search?sort=newest&page=8&pagesize=50&q=[openstack]Nova,Q: How do i trace a particular terminal command?,"In Openstack, lets say for example, i'm entering the command and i start up an instance using the image myimage and use flavor 1. nova boot --image myimage --flavor 1 server1 How can i actually __,0""",http://stackoverflow.com/questions/15311510/how-do-i-trace-a-particular-terminal-command,10:59.9,3e5f4a631ee1d1fac7acdd22fbdff83d,"[u'python', u'ubuntu', u'openstack', u'openstack-nova']",Nova,
0,http://stackoverflow.com/search?sort=newest&page=8&pagesize=50&q=[openstack]Nova,A: Open source Rails gem for the OpenStack API?,"Take a look to the OpenStack ActiveResource gem. It's an OpenStack Ruby (and RoR) bindings implemented on top of ActiveResource that supports Keystone (admin and public), Nova and Glance. __,0""",http://stackoverflow.com/questions/13388213/open-source-rails-gem-for-the-openstack-api/14542701#14542701,11:00.0,82ca05bfbc88777fba428cf8b5653106,[],Nova,
2,http://stackoverflow.com/search?sort=newest&page=8&pagesize=50&q=[openstack]Nova,A: Getting a list of block storage volumes at Rackspace using novaclient Python API,"novaclient.client import Client nova = Client(version = 2, username = '******', project_id = '******', api_key __,0""",http://stackoverflow.com/questions/23699945/getting-a-list-of-block-storage-volumes-at-rackspace-using-novaclient-python-api/23705780#23705780,11:00.1,45908369dd6efdf9ed2e148535eca109,[],Nova,
1,http://stackoverflow.com/search?sort=newest&page=8&pagesize=50&q=[openstack]Nova,A: Partition drive automatically/set OS-DCF:diskConfig to auto with nova,"-novaclient-ext Next up, use the --disk-config=AUTO option: $ nova boot server01 --disk-config=AUTO --image 62df001e-87ee-407c-b042-6f4e13f5d7e1 --flavor performance2-60 Note that this is an extension __by Rackspace, so if this is for a separate OpenStack",http://stackoverflow.com/questions/20013603/partition-drive-automatically-set-os-dcfdiskconfig-to-auto-with-nova/20013604#20013604,11:00.3,2832e1712240c335cd8ea71a694d2f18,[],Nova,
0,http://stackoverflow.com/search?sort=newest&page=8&pagesize=50&q=[openstack]Nova,Q: Openstack - Selectively deleting images based on some criteria?,"We are creating openstack Images nightly with Packer. We want to keep the last 5 that we've created and automatically delete the rest. (Ideally delete them only if they have no instance running __that is based on them, but indiscriminately is fine if that is not possible). I have been looking through the documentation of the various Openstack APIs and I can't seem to find a neat way to do __,0""",http://stackoverflow.com/questions/31432892/openstack-selectively-deleting-images-based-on-some-criteria,11:00.4,a4452ea814640cf022c463bae8be8f7c,"[u'python', u'bash', u'openstack', u'openstack-nova', u'packer']",Nova,
0,http://stackoverflow.com/search?sort=newest&page=8&pagesize=50&q=[openstack]Nova,Q: Executing Openstack-Rally test cases,"I have openstack liberty installed in my ubuntu server. I need to run all Rally test cases. I did rally deployment.Now I am able to execute single '.json' file and getting the '.html' and '.xml __' output. eg: root@ubuntu:/usr/share/rally/samples/tasks/scenarios/nova# rally task start list-images.json This way I can execute individual '.json' files only. My requirement: I have around 250 '.json __,0""",http://stackoverflow.com/questions/36646344/executing-openstack-rally-test-cases,11:00.6,7dbfa37f94830f5022b72d20f3c5e6b0,"[u'rally', u'openstack', u'openstack-nova']",Nova,
0,http://stackoverflow.com/search?sort=newest&page=8&pagesize=50&q=[openstack]Nova,Q: How to sync / update local (volume) data with OpenStack server?,"I want to create a server within OpenStack nova. The first step is to create a volume from an image: volume = cinder.volumes.create(5, name=""test"", imageRef=some_id, ...) The volume __,0""",http://stackoverflow.com/questions/34921177/how-to-sync-update-local-volume-data-with-openstack-server,11:00.8,f72378af014ad0f7b45bcf9bfb79dada,"[u'openstack', u'openstack-cinder', u'openstack-python-api']",Nova,
0,http://stackoverflow.com/search?sort=newest&page=8&pagesize=50&q=[openstack]Nova,Q: openstack: how create bridge on guest vm,"We would like to use nested kvm on guest machine in openstack. To expose nested guest machine to network we are going to use bridge. but our bridged interfaces does not get IP addresses by dhcp __. Seems it's issue with openstack firewall. because openstack control pairs of mac address and IP i have used this tutorial to disable firewall - https://gist.github.com/djoreilly __,0""",http://stackoverflow.com/questions/37496005/openstack-how-create-bridge-on-guest-vm,11:00.9,ef11e5894cdaa120e4a72f16d1e4c1b1,"[u'openstack', u'openstack-nova', u'openstack-neutron']",Nova,
0,http://stackoverflow.com/search?sort=newest&page=8&pagesize=50&q=[openstack]Nova,Q: openstack devstack - Unable to stop service using screen,"I need to stop the nova services which is running in openstack devstack. So as per the previous guidance I have tried using Screen for the same. Actually I can see that services currently running __,0""",http://stackoverflow.com/questions/32352918/openstack-devstack-unable-to-stop-service-using-screen,11:01.1,41f4c5ceed337eadd7152293a22a1e22,"[u'openstack', u'gnu-screen', u'openstack-nova']",Nova,
1,http://stackoverflow.com/search?sort=newest&page=8&pagesize=50&q=[openstack]Nova,A: Add Security Groups to Instance in Openstack,"NovaApi novaApi = ContextBuilder .newBuilder(""openstack-nova"") .credentials(""username"", ""api_key"") .buildApi(NovaApi.class); Ingress ingress = Ingress.builder().fromPort(80 __,0""",http://stackoverflow.com/questions/23452621/add-security-groups-to-instance-in-openstack/23523868#23523868,11:01.2,ac653d8baa3667215dd152cceea85d45,[],Nova,
0,http://stackoverflow.com/search?sort=newest&page=8&pagesize=50&q=[openstack]Nova,A: Launch Openstack Instances using python-boto,"Have you tried? : from boto import ec2 ostack = ec2.connection.EC2Connection( ec2_access_key, ec2_secret_key, is_secure=False, port=8773, region='nova', path='/services/Cloud', debug=1 __,0""",http://stackoverflow.com/questions/21090545/launch-openstack-instances-using-python-boto/21106510#21106510,11:01.4,0a47f9aea503b947a0eccc24abdd2071,[],Nova,
3,http://stackoverflow.com/search?sort=newest&page=8&pagesize=50&q=[openstack]Nova,A: Programmatically setting instance name with the OpenStack Nova API,", }, } self._update(""/servers/%s"" % base.getid(server), body) This indicates that you can update the name of a server by POST-ing the following JSON to http://nova-api:port/v2.0/servers/{server-id __,0""",http://stackoverflow.com/questions/10888476/programmatically-setting-instance-name-with-the-openstack-nova-api/10889097#10889097,11:01.5,b4a937e847706457d12adf0e63a8343a,[],Nova,
0,http://stackoverflow.com/search?sort=newest&page=8&pagesize=50&q=[openstack]Nova,Q: Openstack trove database instance status=error after creating a new instance,"Recently I installed openstack trove using the automated script (devstack). After it is installed successfully and creating some user and projects, I manged to create a database instance and database __of created database instance I stock with database instance is not ready. I did some google and some people mentioned that I should check nova-compute.log, but unfortunately I did not find this log file. Would you please guide me? Regards. __,0""",http://stackoverflow.com/questions/23333988/openstack-trove-database-instance-status-error-after-creating-a-new-instance,11:01.7,00c034ad6a34a64d05f4153e8c95243f,"[u'mysql', u'database', u'openstack']",Nova,
0,http://stackoverflow.com/search?sort=newest&page=7&pagesize=50&q=[openstack]Nova,Q: Adding compute node__ibvirtError: internal error: client socket is closed,"Hii i am trying to additional nova compute node to pre-installed devstack on different machine. I am following this document to add compute node: http://docs.openstack.org/mitaka/install-guide-ubuntu __/nova-compute-install.html my nova.conf file is as follows: [DEFAULT] dhcpbridge_flagfile=/etc/nova/nova.conf dhcpbridge=/usr/bin/nova-dhcpbridge state_path=/var/lib/nova lock_path=/var/lock/nova __,0""",http://stackoverflow.com/questions/39827274/adding-compute-node-libvirterror-internal-error-client-socket-is-closed,11:03.0,917ac4de859b10a8a91d4fd7c4aa8f01,"[u'openstack', u'openstack-nova', u'devstack']",Nova,
0,http://stackoverflow.com/search?sort=newest&page=7&pagesize=50&q=[openstack]Nova,A: Cant start an instance openstack,"Check if all openstack services are up, also you can start only nova services from following command: cd /etc/int.d && for i in $( ls nova-*); do service $i restart; done __,0""",http://stackoverflow.com/questions/25717079/cant-start-an-instance-openstack/25843938#25843938,11:03.2,da9471f352e932804c8dfb5e6eef0227,[],Nova,
3,http://stackoverflow.com/search?sort=newest&page=7&pagesize=50&q=[openstack]Nova,Q: What is the value/benefit of OpenStack _�Network/Storage_� nodes?,"OpenStack has 3 types of core nodes: Compute (Nova) Storage (Cinder) Network (Neutron) But to me, all Compute/Nova instances are VMs. VMs with file systems. VMs that need to be networked __, at first blush, seems unnecessary. Couldn't all nodes be Compute/Nova nodes? Why do I need Cinder/Storage nodes for file system space? Each Nova node will have its own file system, yes? Why do I __,0""",http://stackoverflow.com/questions/28076994/what-is-the-value-benefit-of-openstack-network-storage-nodes,11:03.3,2ccf6ce7786bde0efb846e2086145ce3,"[u'openstack', u'openstack-nova', u'openstack-neutron', u'openstack-cinder']",Nova,
0,http://stackoverflow.com/search?sort=newest&page=7&pagesize=50&q=[openstack]Nova,Q: OpenStack-Swift Data Writing Mechanism,"From where Should I start if I want to learn the Flow(Mechanism) in which the data is written into Cloud Storage using Swift and Nova (OpenStack)? __,0""",http://stackoverflow.com/questions/38047087/openstack-swift-data-writing-mechanism,11:03.5,89d3bc1c3d62e575cb179a713854bbfe,"[u'openstack', u'openstack-nova', u'openstack-swift', u'cloud-storage']",Nova,
2,http://stackoverflow.com/search?sort=newest&page=7&pagesize=50&q=[openstack]Nova,A: How to add a table in Nova Database : Openstack,"Create your model inside nova/db/sqlalchemy/models.py Create migration file inside nova/db/sqlalchemy/migrate_repo/versions/ . You can do this by simply adding a .py file with an increased version __number Provide upgrade() and downgrade() functions as described in this pdf sync nova db using: nova-manage db sync __,0""",http://stackoverflow.com/questions/19424901/how-to-add-a-table-in-nova-database-openstack/24900366#24900366,11:03.7,da72763f80c0b70f6088bc1ef4782b49,[],Nova,
-1,http://stackoverflow.com/search?sort=newest&page=7&pagesize=50&q=[openstack]Nova,"Q: Openstack Failed to launch instance _�test_�: Please try again later [Error: No valid host was__,I try to make instance on openstack private cloud web UI. But it fails.The error code is Failed to launch instance """"test"""": Please try again later [Error: No valid host was found. ]. In /var/log __/nova/nova-scheduler.log these errors are shown. 2015-03-16 03:32:26.824 1705 INFO oslo.messaging._drivers.impl_rabbit [req-50543fb4-b607-4b50-9578-6435600d516b ] Delaying reconnect for 1.0 seconds __",0,http://stackoverflow.com/questions/29065477/openstack-failed-to-launch-instance-test-please-try-again-later-error-no-va,11:03.8,6099b9c2268aac4020a5ed335f7b3ca0,"[u'amqp', u'openstack', u'openstack-nova']",Nova,
0,http://stackoverflow.com/search?sort=newest&page=7&pagesize=50&q=[openstack]Nova,A: Download specific openstack milestone,"to run for nova NOVA_REPO=https://review.openstack.org/p/openstack/nova NOVA_BRANCH=refs/changes/50/5050/1 __,0""",http://stackoverflow.com/questions/31854440/download-specific-openstack-milestone/31871922#31871922,11:04.0,29b9ea783e6dba12570e257ae2be765e,[],Nova,
0,http://stackoverflow.com/search?sort=newest&page=7&pagesize=50&q=[openstack]Nova,A: Can't SSH after creating an Instance from Command line,"There was a problem in ssh key generation, I was generating ssh key like ssh-keygen -t rsa -f newdemokey.key and then add this key into nova keypair-list. That was not working to ssh instance __But the best way is to generate ssh key is, ssh-keygen And add this key into nova keypair-list, nova keypair-add --pub-key ~/.ssh/id_rsa.pub test-key It will work with the new instance to ssh. __,0""",http://stackoverflow.com/questions/24010339/cant-ssh-after-creating-an-instance-from-command-line/24016003#24016003,11:04.1,7bc9fdb161af45f512ecb9702db5d7a2,[],Nova,
0,http://stackoverflow.com/search?sort=newest&page=7&pagesize=50&q=[openstack]Nova,Q: how to list openstack services with full info. using python api,"I'm having trouble getting the information I need from openstack python API. I want to query nova to get a list of nova services AND other information related to the services. With shell command __""nova service-list"" command, I have all I need including the status of each services, like output stated below: http://docs.openstack.org/user-guide-admin/content/section_cli_manage_services.html __,0""",http://stackoverflow.com/questions/27928491/how-to-list-openstack-services-with-full-info-using-python-api,11:04.3,648ee3238f0ab2b3d96a43247e0a679f,"[u'python', u'api', u'openstack']",Nova,
0,http://stackoverflow.com/search?sort=newest&page=7&pagesize=50&q=[openstack]Nova,"A: nova-scheduler don`t rpc.cast to nova-compute, no errors, but vm in 'scheduling' state","If you exec nova list, are you see network interfaces of the new vm? __,0""",http://stackoverflow.com/questions/32586779/nova-scheduler-dont-rpc-cast-to-nova-compute-no-errors-but-vm-in-scheduling/32591595#32591595,11:04.4,bd529187a8c80520e4ce63fe9be3fa7e,[],Nova,
-1,http://stackoverflow.com/search?sort=newest&page=7&pagesize=50&q=[openstack]Nova,Q: glance image-list with specific image name,"I run this command to get specific nova instance.here in my case ""MyProxy-VM"" nova list --name MyProxy-VM --fields id |grep MyProxy-VM |cut -f 2 -d ""|"" It works fine and also bit faster I want __to list specific glance image say ""Ubuntu-14.04"" glance image-list | grep Ubuntu-14.04 | awk '{print $2;} This command takes time so i want to list specific image. I didn't find any option for this in openstack docs. Is there any way to do this. __,0""",http://stackoverflow.com/questions/34435903/glance-image-list-with-specific-image-name,11:04.6,fc2e76a2b5435b7a011b57f8d9efa9a6,"[u'openstack', u'openstack-nova', u'openstack-glance']",Nova,
0,http://stackoverflow.com/search?sort=newest&page=7&pagesize=50&q=[openstack]Nova,Q: Is there an API in jclouds to call _�/os-cells/capacity_�,"Openstack nova has an api called ""/os-cells/capacity"" that provides the capacity details of a region in openstack. Is there a corresponding API in jclouds? __,0""",http://stackoverflow.com/questions/40143501/is-there-an-api-in-jclouds-to-call-os-cells-capacity,11:04.8,5a763cd389a5e69444bd244866c94aae,"[u'openstack', u'openstack-nova', u'jclouds']",Nova,
2,http://stackoverflow.com/search?sort=newest&page=7&pagesize=50&q=[openstack]Nova,A: Is it possible to use cloud-init and heat-cfntools inside a Docker container?,"requirements, (c) is probably the most problematic; unless you are booting containers using the nova-docker driver, is is unlikely that your containers will have access to the Nova metadata service. I am __,0""",http://stackoverflow.com/questions/28456331/is-it-possible-to-use-cloud-init-and-heat-cfntools-inside-a-docker-container/28459663#28459663,11:04.9,f1b731d80a1317cf406027f0a1f8f792,[],Nova,
1,http://stackoverflow.com/search?sort=newest&page=7&pagesize=50&q=[openstack]Nova,A: How do i trace a particular terminal command?,"In addition to what Lorin said you can run ""nova --debug boot ... "" to see the REST API calls that the nova CLI makes to keystone and the nova-api. __,0""",http://stackoverflow.com/questions/15311510/how-do-i-trace-a-particular-terminal-command/15319357#15319357,11:05.1,295b7db8c5c0e73f9db970dd17f5b738,[],Nova,
